### ISSUE TITLE
Need help configuring Netdata with Victoria Metrics

### ISSUE THREAD

**Issue by agrimal** [VictoriaMetrics/VictoriaMetrics#867]
## Describe the bug
Netdata can't export metrics to Victoria Metrics in recent version.  
This was working with Netdata v1.24.0 and Victoria Metrics v1.32.
I upgraded both then it's not working anymore.
When Netdata restarts, it sends some metrics then stop with the following error :
```
2020-10-28 11:53:43: netdata INFO  : EXPORTING : Processing connector instance (victoria_metrics)
2020-10-28 11:53:43: netdata INFO  : EXPORTING : Instance (victoria_metrics) on connector (prometheus_remote_write) is enabled and scheduled for activation
2020-10-28 11:53:43: netdata INFO  : EXPORTING : Instance victoria_metrics on prometheus_remote_write
2020-10-28 11:53:44: netdata INFO  : EXPORTING : enabled exporting of host 'localhost' for instance 'victoria_metrics'
2020-10-28 11:53:49: netdata ERROR : EXPORTING : EXPORTING: cannot format metric for victoria_metrics
2020-10-28 11:53:49: netdata ERROR : EXPORTING : EXPORTING: Instance victoria_metrics disabled
```

## Architecture
- VM1 (rvprx) is running Netdata
- VM2 (victoria-metrics1) is running vminsert and vmstorage
- VM3 (grafana) is running Grafana and vmselect
- VM1 push metrics to VM2 in Prometheus Remote Write format

## Information
Here is a tcpdump capture from VM2 when Netdata is restarted on VM1 :
```
12:17:41.002474 IP rvprx.42276 > victoria-metrics1.8480: Flags [P.], seq 1701777433:1701777647, ack 2564158973, win 485, options [nop,nop,TS val 4070373346 ecr 590339784], length 214
E..
Ht@.@...
...
....$! eo.................
....#/..POST /insert/1/prometheus HTTP/1.1
Host: victoria-metrics1:8480
Accept: */*
X-Prometheus-Remote-Write-Version: 0.1.0
Content-Length: 3536
Content-Type: application/x-www-form-urlencoded

12:17:41.002691 IP rvprx.42276 > victoria-metrics1.8480: Flags [P.], seq 214:3750, ack 1, win 485, options [nop,nop,TS val 4070373346 ecr 590341831], length 3536
E...Hu@.@.."
...
....$! eo...........x.....
....#/......@
k
.
.__name__..netdata_info
.
.instance..rvprx
[truncated]
#/......HTTP/1.1 204 No Content
Date: Wed, 28 Oct 2020 11:17:41 GMT

12:17:45.324148 IP rvprx.42276 > victoria-metrics1.8480: Flags [P.], seq 3750:3965, ack 65, win 485, options [nop,nop,TS val 4070377668 ecr 590341832], length 215
E...Hw@.@...
...
....$! eo.....=.....r.....
....#/..POST /insert/1/prometheus HTTP/1.1
Host: victoria-metrics1:8480
Accept: */*
X-Prometheus-Remote-Write-Version: 0.1.0
Content-Length: 31145
Content-Type: application/x-www-form-urlencoded

12:17:45.324191 IP rvprx.42276 > victoria-metrics1.8480: Flags [.], seq 3965:30509, ack 65, win 485, options [nop,nop,TS val 4070377668 ecr 590341832], length 26544
[truncated]

12:17:45.325064 IP rvprx.42276 > victoria-metrics1.8480: Flags [P.], seq 30509:35110, ack 65, win 485, options [nop,nop,TS val 4070377669 ecr 590346154], length 4601
[truncated]

12:17:45.325963 IP victoria-metrics1.8480 > rvprx.42276: Flags [P.], seq 65:129, ack 35110, win 443, options [nop,nop,TS val 590346155 ecr 4070377669], length 64
E..t|.@.@...
...
...! .$...=eo.?....%......
#/......HTTP/1.1 204 No Content
Date: Wed, 28 Oct 2020 11:17:45 GMT

12:17:49.317750 IP rvprx.42276 > victoria-metrics1.8480: Flags [P.], seq 35110:35325, ack 129, win 485, options [nop,nop,TS val 4070381661 ecr 590346155], length 215
E...H}@.@...
...
....$! eo.?...}.....2.....
...]#/..POST /insert/1/prometheus HTTP/1.1
Host: victoria-metrics1:8480
Accept: */*
X-Prometheus-Remote-Write-Version: 0.1.0
Content-Length: 31109
Content-Type: application/x-www-form-urlencoded

12:17:49.317784 IP rvprx.42276 > victoria-metrics1.8480: Flags [.], seq 35325:61869, ack 129, win 485, options [nop,nop,TS val 4070381661 ecr 590346155], length 26544
[truncated]

12:17:49.319559 IP victoria-metrics1.8480 > rvprx.42276: Flags [P.], seq 129:193, ack 66434, win 443, options [nop,nop,TS val 590350149 ecr 4070381662], length 64
E..t|.@.@...
...
...! .$...}ep......%......
#0.E...^HTTP/1.1 204 No Content
Date: Wed, 28 Oct 2020 11:17:49 GMT
```

## Versions
All VM are running Debian 10 Buster up-to-date
```
root@rvprx [~] # netdata -version
netdata v1.26.0

root@victoria-metrics1 [~] # vminsert -version
vminsert-20200923-004417-tags-v1.41.1-cluster-0-g90d254942

root@grafana [~] # grafana-server -v
Version 7.2.2 (commit: ad9d408ac2, branch: HEAD)
root@grafana [~] # vmselect -version
vmselect-20200923-004424-tags-v1.41.1-cluster-0-g90d254942
```

### Netdata

```
root@rvprx [~] # cat /etc/netdata/netdata.conf
[global]
    run as user = netdata
    web files owner = root
    web files group = netdata
    history = 3600
    memory mode = save

[statsd]
    enabled = no

[plugins]
    tc = no
    node.d = no
    freeipmi = no
    ebpf = no

[plugin:proc:/proc/net/dev]
    drops for all interfaces = no
```

```
root@rvprx [~] # cat /etc/netdata/exporting.conf 
[prometheus_remote_write:victoria_metrics]
enabled = yes
type = prometheus_remote_write
destination = victoria-metrics1:8480
remote write URL path = /insert/1/prometheus
data source = as collected
prefix = netdata
update every = 5
timeout ms = 10000
```

### vminsert

```
2020-10-28T10:52:26+0100 victoria-metrics1 systemd[1]: Started Victoria Metrics - Insert Daemon.
2020-10-28T10:52:26+0100 victoria-metrics1 vminsert[15493]: info        VictoriaMetrics/lib/logger/flag.go:12        build version: vminsert-20200923-004417-tags-v1.41.1-cluster-0-g90d254942
2020-10-28T10:52:26+0100 victoria-metrics1 vminsert[15493]: info        VictoriaMetrics/lib/logger/flag.go:13        command line flags
2020-10-28T10:52:26+0100 victoria-metrics1 vminsert[15493]: info        VictoriaMetrics/lib/logger/flag.go:21        flag "csvTrimTimestamp" = "1ms"
2020-10-28T10:52:26+0100 victoria-metrics1 vminsert[15493]: info        VictoriaMetrics/lib/logger/flag.go:21        flag "enableTCP6" = "false"
2020-10-28T10:52:26+0100 victoria-metrics1 vminsert[15493]: info        VictoriaMetrics/lib/logger/flag.go:21        flag "envflag.enable" = "false"
2020-10-28T10:52:26+0100 victoria-metrics1 vminsert[15493]: info        VictoriaMetrics/lib/logger/flag.go:21        flag "envflag.prefix" = ""
2020-10-28T10:52:26+0100 victoria-metrics1 vminsert[15493]: info        VictoriaMetrics/lib/logger/flag.go:21        flag "fs.disableMmap" = "false"
2020-10-28T10:52:26+0100 victoria-metrics1 vminsert[15493]: info        VictoriaMetrics/lib/logger/flag.go:21        flag "graphiteListenAddr" = ""
2020-10-28T10:52:26+0100 victoria-metrics1 vminsert[15493]: info        VictoriaMetrics/lib/logger/flag.go:21        flag "graphiteTrimTimestamp" = "1s"
2020-10-28T10:52:26+0100 victoria-metrics1 vminsert[15493]: info        VictoriaMetrics/lib/logger/flag.go:21        flag "http.connTimeout" = "2m0s"
2020-10-28T10:52:26+0100 victoria-metrics1 vminsert[15493]: info        VictoriaMetrics/lib/logger/flag.go:21        flag "http.disableResponseCompression" = "true"
2020-10-28T10:52:26+0100 victoria-metrics1 vminsert[15493]: info        VictoriaMetrics/lib/logger/flag.go:21        flag "http.idleConnTimeout" = "1m0s"
2020-10-28T10:52:26+0100 victoria-metrics1 vminsert[15493]: info        VictoriaMetrics/lib/logger/flag.go:21        flag "http.maxGracefulShutdownDuration" = "7s"
2020-10-28T10:52:26+0100 victoria-metrics1 vminsert[15493]: info        VictoriaMetrics/lib/logger/flag.go:21        flag "http.pathPrefix" = ""
2020-10-28T10:52:26+0100 victoria-metrics1 vminsert[15493]: info        VictoriaMetrics/lib/logger/flag.go:21        flag "http.shutdownDelay" = "0s"
2020-10-28T10:52:26+0100 victoria-metrics1 vminsert[15493]: info        VictoriaMetrics/lib/logger/flag.go:21        flag "httpListenAddr" = "0.0.0.0:8480"
2020-10-28T10:52:26+0100 victoria-metrics1 vminsert[15493]: info        VictoriaMetrics/lib/logger/flag.go:21        flag "import.maxLineLen" = "104857600"
2020-10-28T10:52:26+0100 victoria-metrics1 vminsert[15493]: info        VictoriaMetrics/lib/logger/flag.go:21        flag "influxListenAddr" = ""
2020-10-28T10:52:26+0100 victoria-metrics1 vminsert[15493]: info        VictoriaMetrics/lib/logger/flag.go:21        flag "influxMeasurementFieldSeparator" = "_"
2020-10-28T10:52:26+0100 victoria-metrics1 vminsert[15493]: info        VictoriaMetrics/lib/logger/flag.go:21        flag "influxSkipMeasurement" = "false"
2020-10-28T10:52:26+0100 victoria-metrics1 vminsert[15493]: info        VictoriaMetrics/lib/logger/flag.go:21        flag "influxSkipSingleField" = "false"
2020-10-28T10:52:26+0100 victoria-metrics1 vminsert[15493]: info        VictoriaMetrics/lib/logger/flag.go:21        flag "influxTrimTimestamp" = "1ms"
2020-10-28T10:52:26+0100 victoria-metrics1 vminsert[15493]: info        VictoriaMetrics/lib/logger/flag.go:21        flag "insert.maxQueueDuration" = "1m0s"
2020-10-28T10:52:26+0100 victoria-metrics1 vminsert[15493]: info        VictoriaMetrics/lib/logger/flag.go:21        flag "loggerDisableTimestamps" = "true"
2020-10-28T10:52:26+0100 victoria-metrics1 vminsert[15493]: info        VictoriaMetrics/lib/logger/flag.go:21        flag "loggerErrorsPerSecondLimit" = "10"
2020-10-28T10:52:26+0100 victoria-metrics1 vminsert[15493]: info        VictoriaMetrics/lib/logger/flag.go:21        flag "loggerFormat" = "default"
2020-10-28T10:52:26+0100 victoria-metrics1 vminsert[15493]: info        VictoriaMetrics/lib/logger/flag.go:21        flag "loggerLevel" = "INFO"
2020-10-28T10:52:26+0100 victoria-metrics1 vminsert[15493]: info        VictoriaMetrics/lib/logger/flag.go:21        flag "loggerOutput" = "stdout"
2020-10-28T10:52:26+0100 victoria-metrics1 vminsert[15493]: info        VictoriaMetrics/lib/logger/flag.go:21        flag "maxConcurrentInserts" = "16"
2020-10-28T10:52:26+0100 victoria-metrics1 vminsert[15493]: info        VictoriaMetrics/lib/logger/flag.go:21        flag "maxInsertRequestSize" = "33554432"
2020-10-28T10:52:26+0100 victoria-metrics1 vminsert[15493]: info        VictoriaMetrics/lib/logger/flag.go:21        flag "maxLabelsPerTimeseries" = "30"
2020-10-28T10:52:26+0100 victoria-metrics1 vminsert[15493]: info        VictoriaMetrics/lib/logger/flag.go:21        flag "memory.allowedBytes" = "0"
2020-10-28T10:52:26+0100 victoria-metrics1 vminsert[15493]: info        VictoriaMetrics/lib/logger/flag.go:21        flag "memory.allowedPercent" = "60"
2020-10-28T10:52:26+0100 victoria-metrics1 vminsert[15493]: info        VictoriaMetrics/lib/logger/flag.go:21        flag "opentsdbHTTPListenAddr" = ""
2020-10-28T10:52:26+0100 victoria-metrics1 vminsert[15493]: info        VictoriaMetrics/lib/logger/flag.go:21        flag "opentsdbListenAddr" = ""
2020-10-28T10:52:26+0100 victoria-metrics1 vminsert[15493]: info        VictoriaMetrics/lib/logger/flag.go:21        flag "opentsdbTrimTimestamp" = "1s"
2020-10-28T10:52:26+0100 victoria-metrics1 vminsert[15493]: info        VictoriaMetrics/lib/logger/flag.go:21        flag "opentsdbhttp.maxInsertRequestSize" = "33554432"
2020-10-28T10:52:26+0100 victoria-metrics1 vminsert[15493]: info        VictoriaMetrics/lib/logger/flag.go:21        flag "opentsdbhttpTrimTimestamp" = "1ms"
2020-10-28T10:52:26+0100 victoria-metrics1 vminsert[15493]: info        VictoriaMetrics/lib/logger/flag.go:21        flag "relabelConfig" = ""
2020-10-28T10:52:26+0100 victoria-metrics1 vminsert[15493]: info        VictoriaMetrics/lib/logger/flag.go:21        flag "replicationFactor" = "1"
2020-10-28T10:52:26+0100 victoria-metrics1 vminsert[15493]: info        VictoriaMetrics/lib/logger/flag.go:21        flag "rpc.disableCompression" = "true"
2020-10-28T10:52:26+0100 victoria-metrics1 vminsert[15493]: info        VictoriaMetrics/lib/logger/flag.go:21        flag "storageNode" = "victoria-metrics1:8400,victoria-metrics2:8400,victoria-metrics3:8400"
2020-10-28T10:52:26+0100 victoria-metrics1 vminsert[15493]: info        VictoriaMetrics/lib/logger/flag.go:21        flag "tls" = "false"
2020-10-28T10:52:26+0100 victoria-metrics1 vminsert[15493]: info        VictoriaMetrics/lib/logger/flag.go:21        flag "tlsCertFile" = ""
2020-10-28T10:52:26+0100 victoria-metrics1 vminsert[15493]: info        VictoriaMetrics/lib/logger/flag.go:21        flag "tlsKeyFile" = "secret"
2020-10-28T10:52:26+0100 victoria-metrics1 vminsert[15493]: info        VictoriaMetrics/lib/logger/flag.go:21        flag "version" = "false"
2020-10-28T10:52:26+0100 victoria-metrics1 vminsert[15493]: info        VictoriaMetrics/lib/cgroup/cpu.go:31        cgroup CPU quota=5 exceeds NumCPU=4; using GOMAXPROCS=NumCPU
2020-10-28T10:52:26+0100 victoria-metrics1 vminsert[15493]: info        VictoriaMetrics/app/vminsert/main.go:68        initializing netstorage for storageNodes [victoria-metrics1:8400 victoria-metrics2:8400 victoria-metrics3:8400]...
2020-10-28T10:52:26+0100 victoria-metrics1 vminsert[15493]: info        VictoriaMetrics/lib/memory/memory.go:43        limiting caches to 1727764070 bytes, leaving 1151842714 bytes to the OS according to -memory.allowedPercent=60.000000
2020-10-28T10:52:26+0100 victoria-metrics1 vminsert[15493]: info        VictoriaMetrics/app/vminsert/main.go:74        successfully initialized netstorage in 0.004 seconds
2020-10-28T10:52:26+0100 victoria-metrics1 vminsert[15493]: info        VictoriaMetrics/lib/httpserver/httpserver.go:78        starting http server at http://0.0.0.0:8480/
2020-10-28T10:52:26+0100 victoria-metrics1 vminsert[15493]: info        VictoriaMetrics/lib/httpserver/httpserver.go:79        pprof handlers are exposed at http://0.0.0.0:8480/debug/pprof/
```

### vmstorage
```
2020-10-28T11:48:11+0100 victoria-metrics1 systemd[1]: Started Victoria Metrics - Storage Daemon.
2020-10-28T11:48:11+0100 victoria-metrics1 vmstorage[22765]: info        VictoriaMetrics/lib/logger/flag.go:12        build version: vmstorage-20200923-004430-tags-v1.41.1-cluster-0-g90d254942
2020-10-28T11:48:11+0100 victoria-metrics1 vmstorage[22765]: info        VictoriaMetrics/lib/logger/flag.go:13        command line flags
2020-10-28T11:48:11+0100 victoria-metrics1 vmstorage[22765]: info        VictoriaMetrics/lib/logger/flag.go:21        flag "bigMergeConcurrency" = "0"
2020-10-28T11:48:11+0100 victoria-metrics1 vmstorage[22765]: info        VictoriaMetrics/lib/logger/flag.go:21        flag "dedup.minScrapeInterval" = "0s"
2020-10-28T11:48:11+0100 victoria-metrics1 vmstorage[22765]: info        VictoriaMetrics/lib/logger/flag.go:21        flag "denyQueriesOutsideRetention" = "false"
2020-10-28T11:48:11+0100 victoria-metrics1 vmstorage[22765]: info        VictoriaMetrics/lib/logger/flag.go:21        flag "enableTCP6" = "false"
2020-10-28T11:48:11+0100 victoria-metrics1 vmstorage[22765]: info        VictoriaMetrics/lib/logger/flag.go:21        flag "envflag.enable" = "false"
2020-10-28T11:48:11+0100 victoria-metrics1 vmstorage[22765]: info        VictoriaMetrics/lib/logger/flag.go:21        flag "envflag.prefix" = ""
2020-10-28T11:48:11+0100 victoria-metrics1 vmstorage[22765]: info        VictoriaMetrics/lib/logger/flag.go:21        flag "forceMergeAuthKey" = "secret"
2020-10-28T11:48:11+0100 victoria-metrics1 vmstorage[22765]: info        VictoriaMetrics/lib/logger/flag.go:21        flag "fs.disableMmap" = "false"
2020-10-28T11:48:11+0100 victoria-metrics1 vmstorage[22765]: info        VictoriaMetrics/lib/logger/flag.go:21        flag "http.connTimeout" = "2m0s"
2020-10-28T11:48:11+0100 victoria-metrics1 vmstorage[22765]: info        VictoriaMetrics/lib/logger/flag.go:21        flag "http.disableResponseCompression" = "true"
2020-10-28T11:48:11+0100 victoria-metrics1 vmstorage[22765]: info        VictoriaMetrics/lib/logger/flag.go:21        flag "http.idleConnTimeout" = "1m0s"
2020-10-28T11:48:11+0100 victoria-metrics1 vmstorage[22765]: info        VictoriaMetrics/lib/logger/flag.go:21        flag "http.maxGracefulShutdownDuration" = "7s"
2020-10-28T11:48:11+0100 victoria-metrics1 vmstorage[22765]: info        VictoriaMetrics/lib/logger/flag.go:21        flag "http.pathPrefix" = ""
2020-10-28T11:48:11+0100 victoria-metrics1 vmstorage[22765]: info        VictoriaMetrics/lib/logger/flag.go:21        flag "http.shutdownDelay" = "0s"
2020-10-28T11:48:11+0100 victoria-metrics1 vmstorage[22765]: info        VictoriaMetrics/lib/logger/flag.go:21        flag "httpListenAddr" = "0.0.0.0:8482"
2020-10-28T11:48:11+0100 victoria-metrics1 vmstorage[22765]: info        VictoriaMetrics/lib/logger/flag.go:21        flag "loggerDisableTimestamps" = "true"
2020-10-28T11:48:11+0100 victoria-metrics1 vmstorage[22765]: info        VictoriaMetrics/lib/logger/flag.go:21        flag "loggerErrorsPerSecondLimit" = "10"
2020-10-28T11:48:11+0100 victoria-metrics1 vmstorage[22765]: info        VictoriaMetrics/lib/logger/flag.go:21        flag "loggerFormat" = "default"
2020-10-28T11:48:11+0100 victoria-metrics1 vmstorage[22765]: info        VictoriaMetrics/lib/logger/flag.go:21        flag "loggerLevel" = "INFO"
2020-10-28T11:48:11+0100 victoria-metrics1 vmstorage[22765]: info        VictoriaMetrics/lib/logger/flag.go:21        flag "loggerOutput" = "stdout"
2020-10-28T11:48:11+0100 victoria-metrics1 vmstorage[22765]: info        VictoriaMetrics/lib/logger/flag.go:21        flag "memory.allowedBytes" = "0"
2020-10-28T11:48:11+0100 victoria-metrics1 vmstorage[22765]: info        VictoriaMetrics/lib/logger/flag.go:21        flag "memory.allowedPercent" = "60"
2020-10-28T11:48:11+0100 victoria-metrics1 vmstorage[22765]: info        VictoriaMetrics/lib/logger/flag.go:21        flag "precisionBits" = "64"
2020-10-28T11:48:11+0100 victoria-metrics1 vmstorage[22765]: info        VictoriaMetrics/lib/logger/flag.go:21        flag "retentionPeriod" = "6"
2020-10-28T11:48:11+0100 victoria-metrics1 vmstorage[22765]: info        VictoriaMetrics/lib/logger/flag.go:21        flag "rpc.disableCompression" = "true"
2020-10-28T11:48:11+0100 victoria-metrics1 vmstorage[22765]: info        VictoriaMetrics/lib/logger/flag.go:21        flag "search.maxTagKeys" = "secret"
2020-10-28T11:48:11+0100 victoria-metrics1 vmstorage[22765]: info        VictoriaMetrics/lib/logger/flag.go:21        flag "search.maxTagValueSuffixesPerSearch" = "100000"
2020-10-28T11:48:11+0100 victoria-metrics1 vmstorage[22765]: info        VictoriaMetrics/lib/logger/flag.go:21        flag "search.maxTagValues" = "100000"
2020-10-28T11:48:11+0100 victoria-metrics1 vmstorage[22765]: info        VictoriaMetrics/lib/logger/flag.go:21        flag "search.maxUniqueTimeseries" = "300000"
2020-10-28T11:48:11+0100 victoria-metrics1 vmstorage[22765]: info        VictoriaMetrics/lib/logger/flag.go:21        flag "smallMergeConcurrency" = "0"
2020-10-28T11:48:11+0100 victoria-metrics1 vmstorage[22765]: info        VictoriaMetrics/lib/logger/flag.go:21        flag "snapshotAuthKey" = "secret"
2020-10-28T11:48:11+0100 victoria-metrics1 vmstorage[22765]: info        VictoriaMetrics/lib/logger/flag.go:21        flag "storageDataPath" = "/var/lib/victoria-metrics/vmstorage"
2020-10-28T11:48:11+0100 victoria-metrics1 vmstorage[22765]: info        VictoriaMetrics/lib/logger/flag.go:21        flag "tls" = "false"
2020-10-28T11:48:11+0100 victoria-metrics1 vmstorage[22765]: info        VictoriaMetrics/lib/logger/flag.go:21        flag "tlsCertFile" = ""
2020-10-28T11:48:11+0100 victoria-metrics1 vmstorage[22765]: info        VictoriaMetrics/lib/logger/flag.go:21        flag "tlsKeyFile" = "secret"
2020-10-28T11:48:11+0100 victoria-metrics1 vmstorage[22765]: info        VictoriaMetrics/lib/logger/flag.go:21        flag "version" = "false"
2020-10-28T11:48:11+0100 victoria-metrics1 vmstorage[22765]: info        VictoriaMetrics/lib/logger/flag.go:21        flag "vminsertAddr" = "0.0.0.0:8400"
2020-10-28T11:48:11+0100 victoria-metrics1 vmstorage[22765]: info        VictoriaMetrics/lib/logger/flag.go:21        flag "vmselectAddr" = "0.0.0.0:8401"
2020-10-28T11:48:11+0100 victoria-metrics1 vmstorage[22765]: info        VictoriaMetrics/lib/cgroup/cpu.go:31        cgroup CPU quota=5 exceeds NumCPU=4; using GOMAXPROCS=NumCPU
2020-10-28T11:48:11+0100 victoria-metrics1 vmstorage[22765]: info        VictoriaMetrics/app/vmstorage/main.go:52        opening storage at "/var/lib/victoria-metrics/vmstorage" with retention period 6 months
2020-10-28T11:48:11+0100 victoria-metrics1 vmstorage[22765]: info        VictoriaMetrics/lib/memory/memory.go:43        limiting caches to 1224447590 bytes, leaving 816298394 bytes to the OS according to -memory.allowedPercent=60.000000
[... logs truncated ...]
2020-10-28T11:48:12+0100 victoria-metrics1 vmstorage[22765]: info        VictoriaMetrics/app/vmstorage/main.go:66        successfully opened storage "/var/lib/victoria-metrics/vmstorage" in 0.202 seconds; partsCount: 60; blocksCount: 2873603; rowsCount: 18348651118; sizeBytes: 16788605183
2020-10-28T11:48:12+0100 victoria-metrics1 vmstorage[22765]: info        VictoriaMetrics/lib/httpserver/httpserver.go:78        starting http server at http://0.0.0.0:8482/
2020-10-28T11:48:12+0100 victoria-metrics1 vmstorage[22765]: info        VictoriaMetrics/lib/httpserver/httpserver.go:79        pprof handlers are exposed at http://0.0.0.0:8482/debug/pprof/
2020-10-28T11:48:12+0100 victoria-metrics1 vmstorage[22765]: info        VictoriaMetrics/app/vmstorage/transport/server.go:120        accepting vminsert conns at 0.0.0.0:8400
2020-10-28T11:48:12+0100 victoria-metrics1 vmstorage[22765]: info        VictoriaMetrics/app/vmstorage/transport/server.go:187        accepting vmselect conns at 0.0.0.0:8401
2020-10-28T11:48:14+0100 victoria-metrics1 vmstorage[22765]: info        VictoriaMetrics/app/vmstorage/transport/server.go:132        accepted vminsert conn from <victoria-metrics1_IP>:34482
2020-10-28T11:48:14+0100 victoria-metrics1 vmstorage[22765]: info        VictoriaMetrics/app/vmstorage/transport/server.go:168        processing vminsert conn from <victoria-metrics1_IP>:34482
```

### Other
I also opened an issue on [Netdata side](https://github.com/netdata/netdata/issues/10152)

**Comment by agrimal** [comment]
Another information : I still have 3 servers with Netdata **1.24.0** pushing metrics working flawlessly.
So maybe the problem is on Netdata's side ?

Here's the configuration :
```
root@otherserver [~] # cat /etc/netdata/netdata.conf
[global]
    run as user = netdata
    web files owner = root
    web files group = netdata
    history = 3600
    memory mode = save

[backend]
    enabled = yes
    type = prometheus_remote_write
    destination = victoria-metrics1:8480
    remote write URL path = /insert/1/prometheus
    data source = as collected
    prefix = netdata
    update every = 15
    timeout ms = 10000
    send charts matching = *
    send hosts matching = localhost *
    send names instead of ids = yes

[statsd]
    enabled = no

[plugins]
    tc = no
    node.d = no
    freeipmi = no
    ebpf = no

[plugin:proc:/proc/net/dev]
    drops for all interfaces = no
```

**Comment by valyala** [comment]
This looks like an issue with newer NetData releases, since older Netdata releases successfully send data to all the latest VictoriaMetrics releases.

**Comment by valyala** [comment]
Closing the issue, since it looks like it should be fixed at Netdata side - see https://github.com/netdata/netdata/issues/10152 .
